{
  "schema_version": "1.0",
  "content_id": "018f6c21-6f66-7802-9a0b-3c1d2e3f4a67",
  "source_id": "018f6c20-5e55-7701-8f9a-2b0c1d3e4f56",
  "format": "html",
  "content_hash": "sha256:1a2b3c4d5e6f",
  "language": "en",
  "fetched_at": "2026-01-15T09:10:00Z",
  "cache_ref": "cache/source-content/018f6c21"
}
